<?xml version="1.0" encoding="UTF-8"?>
<ObjectRelationalAbstraction xmlns="http://tempuri.org/Operation_v1_0.xsd" xmlns:xsi="http://www.w3.org/2001/XMLSchema-instance" xsi:schemaLocation="http://tempuri.org/Operation_v1_0.xsd ObjectRelational_v1_0.xsd">
  <Entities DomainName="ProjectStatusReporting">
    <GeneratorMeta>
      <GeneratorOutput namespaceName="ProjectStatusReporting.BusinessLogic" outputType="" role="BusinessLogic"/>
      <GeneratorOutput namespaceName="ProjectStatusReporting.MVCModel" outputType="" role="MVCModelClasses"/>
      <GeneratorOutput namespaceName="ProjectStatusReporting.MVCModel" outputType="" role="MVCControllerClasses"/>
      <GeneratorOutput namespaceName="ProjectStatusReporting.MVCModel" outputType="" role="MVCViews"/>
    </GeneratorMeta>
    
    <Entity name="Project">
      <ViewGeneration>
        <EditorView displayName="Project Measurements" forType="ProjectMeasurement" pathFromRoot="ProjectStatusInfo.Measurements" isCollection="true" />
        <EditorView displayName="Project Actions" forType="ProjectAction" pathFromRoot="ProjectStatusInfo.Actions" isCollection="true" />
        <EditorView displayName="Project Interest Groups" forType="InterestGroup" pathFromRoot="ProjectStatusInfo.InterestGroups" isCollection="true" />
        <EditorView displayName="Project Results" forType="ProjectResult" pathFromRoot="ProjectStatusInfo.Results" isCollection="true" />
        <EditorView displayName="Project Challenges And Exceptions" forType="ProjectChallenge" pathFromRoot="ProjectStatusInfo.ChallengesAndExceptions" isCollection="true" />
        <EditorView displayName="Project Counter Actions" forType="CounterAction" pathFromRoot="ProjectStatusInfo.CounterActions" isCollection="true" />
      </ViewGeneration>
      <Property dataType="string" name="Name" designDesc="Project's name" state="underDesign"/>
      <Property dataType="string" name="StatusTrackingUrl" designDesc="Status Tracking Data Url" state="underDesign"/>
      <Property dataType="DateTime?" name="TrackingUpdateTime" designDesc="Last update time of status tracking data" state="underDesign"/>
      <Property dataType="StatusTracking_v1_0.StatusTrackingAbstractionType" mappingMode="XML" name="StatusData" designDesc="Status Tracking Data" state="underDesign"/>
      <ChildEntity multiplicity="1" name="ProjectInfo">
        <Entity name="ProjectInfo">
          <Property dataType="string" name="Name" designDesc="" state="underDesign"/>
          <Property dataType="string" name="ResponsibleUnitName" designDesc="" state="underDesign"/>
          <Property dataType="string" name="ResponsiblePersonName" designDesc="" state="underDesign"/>
          <Property dataType="int" name="FocusedYear" designDesc="" state="underDesign"/>
          <Property dataType="decimal" name="FocusedYearBudgetEuros" designDesc="" state="underDesign"/>
          <Property dataType="decimal" name="FocusedYearEstimateEuros" designDesc="" state="underDesign"/>
          <Property dataType="decimal" name="CommittedBudgetForNextYear" designDesc="" state="underDesign"/>
          <Property dataType="string" name="WholeDurationRange" designDesc="" state="underDesign"/>
        </Entity>
      </ChildEntity>
      <ChildEntity name="ProjectStatusInfo" multiplicity="1">
        <Entity name="ProjectStatusInfo">
          <Property dataType="string" name="Owner" designDesc="" state="underDesign"/>
          <Property dataType="DateTime" name="Updated" designDesc="" state="underDesign"/>
          <Property dataType="string" name="Goal" designDesc="" state="underDesign"/>
          <ChildEntity name="Measurements" multiplicity="0_n">
            <Entity name="ProjectMeasurement">
              <Property dataType="string" name="Text" designDesc="" state="underDesign"/>
              <Property dataType="int" name="Status" designDesc="" state="underDesign"/>
            </Entity>
          </ChildEntity>
          <ChildEntity name="Actions" multiplicity="0_n">
            <Entity name="ProjectAction">
              <Property dataType="string" name="Text" designDesc="" state="underDesign"/>
              <Property dataType="int" name="Status" designDesc="" state="underDesign"/>
            </Entity>
          </ChildEntity>
          <ChildEntity name="InterestGroups" multiplicity="0_n">
            <Entity name="InterestGroup">
              <Property dataType="string" name="Name" designDesc="" state="underDesign"/>
            </Entity>
          </ChildEntity>
          <ChildEntity name="Results" multiplicity="0_n">
            <Entity name="ProjectResult">
              <Property dataType="string" name="Text" designDesc="" state="underDesign"/>
            </Entity>
          </ChildEntity>
          <ChildEntity name="ChallengesAndExceptions" multiplicity="0_n">
            <Entity name="ProjectChallenge">
              <Property dataType="string" name="Text" designDesc="" state="underDesign"/>
            </Entity>
          </ChildEntity>
          <ChildEntity name="CounterActions" multiplicity="0_n">
            <Entity name="CounterAction">
              <Property dataType="string" name="Text" designDesc="" state="underDesign"/>
            </Entity>
          </ChildEntity>
        </Entity>
      </ChildEntity>
    </Entity>
  </Entities>
</ObjectRelationalAbstraction>